{
  "analysisEngineVersion": "1.0.0",
  "categoryCoverage": [
    {
      "category": "SC01",
      "note": "release() is correctly restricted to beneficiary; there are no owner/admin roles or other privileged functions in this contract.",
      "status": "NOT_DETECTED"
    },
    {
      "category": "SC02",
      "status": "DETECTED"
    },
    {
      "category": "SC03",
      "note": "No price or rate oracle is read anywhere in this contract.",
      "status": "NOT_DETECTED"
    },
    {
      "category": "SC04",
      "note": "No flash-loan interface or lending-protocol interaction is present.",
      "status": "NOT_DETECTED"
    },
    {
      "category": "SC05",
      "status": "DETECTED"
    },
    {
      "category": "SC06",
      "note": "The single low-level call's boolean return value is checked via require immediately after the call.",
      "status": "NOT_DETECTED"
    },
    {
      "category": "SC07",
      "note": "vestedAmount() multiplies before dividing, which is the precision-preserving order; no division-before-multiplication pattern is present.",
      "status": "NOT_DETECTED"
    },
    {
      "category": "SC08",
      "note": "The missing-cumulative-tracking root cause (no state records the amount already released) also enables a same-transaction reentrant exploit via beneficiary's receive/fallback, but this shares SC02's invariant and remediation exactly (see F-58ed17be) rather than being a second, independent root cause: fixing the SC02 finding (update released before the transfer) closes this path too, so it is not reported as a separate finding here.",
      "status": "NOT_DETECTED"
    },
    {
      "category": "SC09",
      "note": "Solidity 0.8.20 applies default overflow/underflow checks, no unchecked blocks are used, and startTime cannot exceed a later block's timestamp.",
      "status": "NOT_DETECTED"
    },
    {
      "category": "SC10",
      "note": "No delegatecall, proxy structure, or upgrade entry point is present.",
      "status": "NOT_DETECTED"
    }
  ],
  "checklistVersion": "2026.1",
  "compilerVersion": "0.8.20",
  "findings": [
    {
      "category": "SC02",
      "confidence": "high",
      "description": "vestedAmount() always returns the total amount vested since startTime, not the amount still owed, and release() forwards this full to-date figure on every single call instead of the incremental unreleased balance - the contract does not actually implement incremental vested-claim accounting (invariant violated: cumulative amount released must never exceed vestedAmount() minus what was already released). Even with a single, non-malicious beneficiary calling release() more than once as time passes - an ordinary way to interact with a vesting contract - the second call will try to resend the entire cumulative vested amount again, either reverting once the already-paid amount exceeds the remaining balance (permanently stranding the rest of the beneficiary's legitimately vested funds) or, if the contract holds surplus ETH, overpaying beyond the true entitlement. The same missing state update also means that if beneficiary is, or later becomes, a contract, its receive/fallback function can call release() again before the outer call returns and pass the identical check, letting a single transaction's worth of reentrant calls drain far more than what has actually vested - potentially the entire balance - in one shot rather than over several separate calls. Both paths share one root cause and one fix.",
      "evidence": [
        "return (totalAllocation * (block.timestamp - startTime)) / duration;",
        "uint256 amount = vestedAmount();",
        "(bool ok, ) = beneficiary.call{value: amount}(\"\");"
      ],
      "id": "F-58ed17be",
      "locations": [
        {
          "contract": "SimpleVesting",
          "file": "contract_d.sol",
          "function": "vestedAmount",
          "lineEnd": 21,
          "lineStart": 17
        },
        {
          "contract": "SimpleVesting",
          "file": "contract_d.sol",
          "function": "release",
          "lineEnd": 28,
          "lineStart": 24
        }
      ],
      "mergedCount": 1,
      "patch": null,
      "recommendation": "Introduce a released state variable, compute the newly claimable amount as vestedAmount() - released on each call, transfer only that delta, and update released before the transfer (checks-effects-interactions - this ordering is what also closes the reentrant path). Optionally apply a reentrancy guard as defense in depth.",
      "severity": "CRITICAL",
      "signature": "vested-amount-ignores-prior-releases",
      "stableKey": "sha256:58ed17be3a2637680ffa9875d11a29d788c24b14742283714ef90d62d04bf50c",
      "status": "suspected"
    },
    {
      "category": "SC05",
      "confidence": "high",
      "description": "The constructor stores _beneficiary without checking it against address(0), and the contract provides no function to update beneficiary afterward. If it is deployed with the zero address by mistake, release()'s require(msg.sender == beneficiary) can never succeed for any real caller, so any ETH later sent to the contract through the payable receive() function becomes permanently unrecoverable, with no owner or rescue mechanism present anywhere in the contract.",
      "evidence": [
        "constructor(address _beneficiary, uint256 _totalAllocation, uint256 _duration) {",
        "beneficiary = _beneficiary;"
      ],
      "id": "F-4847e013",
      "locations": [
        {
          "contract": "SimpleVesting",
          "file": "contract_d.sol",
          "function": "constructor",
          "lineEnd": 15,
          "lineStart": 10
        }
      ],
      "mergedCount": 1,
      "patch": null,
      "recommendation": "Add require(_beneficiary != address(0), \"zero beneficiary\"); in the constructor.",
      "severity": "LOW",
      "signature": "unchecked-zero-address-beneficiary",
      "stableKey": "sha256:4847e0137021d763341f94b974354d4945264316c06f0847be355ce0160d7ae5",
      "status": "suspected"
    }
  ],
  "generatedBy": "ai",
  "inputHash": "sha256:0d6854ca2fca3eafd2891ed303c1d96f8af6018bdb636f570871cf3688cb521c",
  "language": "en",
  "limitations": [
    "Off-chain logic, deployment configuration and key management were not assessed.",
    "Operational security, infrastructure and tokenomics outside the analyzed code were not assessed.",
    "Deployed contract state and third-party systems were not assessed."
  ],
  "mode": "quick",
  "riskIndicator": {
    "band": "HIGH",
    "explanation": "This indicator reflects findings detected within the analyzed scope. It is not a measure of overall protocol security.",
    "scopeNote": "according to the analyzed scope",
    "score": 40,
    "scoreStatus": "computed"
  },
  "scope": {
    "completeness": "complete",
    "reasons": []
  },
  "scoreStatus": "computed",
  "scoreVersion": "2026.1",
  "scriptsAvailable": true,
  "skillVersion": "1.0.0"
}
